{
  "schema_version": 1,
  "probe_id": "zh-wiki-best-building-materials",
  "source_id": "zh-minecraft-wiki",
  "canonical_url": "https://zh.minecraft.wiki/w/Tutorial%3A%E6%9C%80%E4%BD%B3%E5%BB%BA%E7%AD%91%E6%9D%90%E6%96%99",
  "title": "最佳建筑材料",
  "sample_role": "material-evaluation",
  "selection_reason": "用于观察集体编辑材料参考是否显露可获得性、耐久性和美观性等比较维度。",
  "observed_at": "2026-08-25T00:00:00.000Z",
  "observation_bases": [
    "search-index",
    "unverified"
  ],
  "access_result": {
    "status": "manual-or-api-review-required",
    "http_status": 403,
    "final_url": "https://zh.minecraft.wiki/w/Tutorial%3A%E6%9C%80%E4%BD%B3%E5%BB%BA%E7%AD%91%E6%9D%90%E6%96%99",
    "note": "自动直接访问返回 HTTP 403；观察依赖搜索索引，索引缓存于观察时约已有 1.2 年，需人工或经审查的 API 复核。"
  },
  "content_revision": {
    "status": "unknown",
    "value": null,
    "basis": "unverified"
  },
  "content_fingerprint": {
    "status": "unknown",
    "sha256": null,
    "basis": "unverified"
  },
  "creator_observation": {
    "status": "not-applicable",
    "display_name": null,
    "profile_url": null,
    "bases": [
      "unverified"
    ]
  },
  "observed_structure": [
    "搜索索引显露材料评价涉及可获得性、耐久性和美观性维度；具体条目、权重与正文论证未核验。"
  ],
  "extractable_fields": [
    "规范 URL",
    "页面标题",
    "材料评价维度的有界摘要"
  ],
  "knowledge_value": {
    "principles": {
      "value": 3,
      "reason": "材料比较维度可支持选择原则，但正文论证尚未直接核验。"
    },
    "construction_sequence": {
      "value": 2,
      "reason": "材料主题可辅助施工准备，但索引不支持完整步骤判断。"
    },
    "reference_case": {
      "value": 2,
      "reason": "页面是材料参考而非结构化单体建筑案例。"
    },
    "materials": {
      "value": 4,
      "reason": "页面直接围绕建筑材料选择与比较。"
    },
    "survival_constraints": {
      "value": 4,
      "reason": "可获得性和耐久性维度与生存玩法约束直接相关。"
    },
    "evaluation": {
      "value": 4,
      "reason": "可获得性、耐久性和美观性形成明确的比较维度。"
    },
    "provenance": {
      "value": 2,
      "reason": "集体编辑页面身份可识别，修订与贡献谱系未取得。"
    },
    "access_stability": {
      "value": 1,
      "reason": "自动直接访问返回 403，当前仅有陈旧索引依据。"
    },
    "rights_clarity": {
      "value": "unknown",
      "reason": "本轮没有直接核验页面各类内容的具体许可证据。"
    }
  },
  "rights_observations": {
    "public_access": {
      "status": "unknown",
      "evidence_url": null,
      "checked_at": "2026-08-25T00:00:00.000Z",
      "note": "HTTP 403 只描述本轮自动访问结果，不能证明人类浏览器不可访问或公开访问获准。"
    },
    "local_analysis": {
      "status": "not-reviewed",
      "evidence_url": null,
      "checked_at": "2026-08-25T00:00:00.000Z",
      "note": "除短原创观察外，本地分析权利与许可证条件尚未审查。"
    },
    "automated_retrieval": {
      "status": "not-reviewed",
      "evidence_url": null,
      "checked_at": "2026-08-25T00:00:00.000Z",
      "note": "robots、MediaWiki API 条款、速率和返回结构尚未审查，不尝试绕过限制。"
    },
    "artifact_download": {
      "status": "unknown",
      "evidence_url": null,
      "checked_at": "2026-08-25T00:00:00.000Z",
      "note": "未取得支持下载文章、图片、模板或其他制品的证据。"
    },
    "model_training": {
      "status": "unknown",
      "evidence_url": null,
      "checked_at": "2026-08-25T00:00:00.000Z",
      "note": "未取得支持模型训练的具体许可证据。"
    },
    "external_redistribution": {
      "status": "unknown",
      "evidence_url": null,
      "checked_at": "2026-08-25T00:00:00.000Z",
      "note": "未核验文本、图片、模板或结构化事实的外部再分发条件。"
    }
  },
  "blocking_conditions": [
    "修订、正文论证和内容指纹未核验。",
    "自动访问、API 与具体权利边界尚未审查。"
  ],
  "recommended_adapter_behavior": [
    "获批后仅在 robots、API 与条款审查后使用修订绑定、保留署名的 MediaWiki 只读文章适配器。",
    "文本、图片和结构化事实必须作为不同权利类别处理，不直接进入课程、规则或训练。"
  ],
  "summary": "该探针只记录索引显露的材料可获得性、耐久性和美观性比较维度，不重建条目、权重或正文。"
}
