{
  "schema_version": 1,
  "probe_id": "zh-wiki-roof-types",
  "source_id": "zh-minecraft-wiki",
  "canonical_url": "https://zh.minecraft.wiki/w/Tutorial%3A%E5%B1%8B%E9%A1%B6%E7%B1%BB%E5%9E%8B",
  "title": "屋顶类型",
  "sample_role": "roof-type-taxonomy",
  "selection_reason": "用于观察集体编辑页面作为屋顶类型分类参考的定位，不重建缓存中的类型清单。",
  "observed_at": "2026-08-25T00:00:00.000Z",
  "observation_bases": [
    "search-index",
    "unverified"
  ],
  "access_result": {
    "status": "manual-or-api-review-required",
    "http_status": 403,
    "final_url": "https://zh.minecraft.wiki/w/Tutorial%3A%E5%B1%8B%E9%A1%B6%E7%B1%BB%E5%9E%8B",
    "note": "自动直接访问返回 HTTP 403；观察依赖搜索索引，索引缓存于观察时约已有 1.2 年，需人工或经审查的 API 复核。"
  },
  "content_revision": {
    "status": "unknown",
    "value": null,
    "basis": "unverified"
  },
  "content_fingerprint": {
    "status": "unknown",
    "sha256": null,
    "basis": "unverified"
  },
  "creator_observation": {
    "status": "not-applicable",
    "display_name": null,
    "profile_url": null,
    "bases": [
      "unverified"
    ]
  },
  "observed_structure": [
    "搜索索引可识别该页面为屋顶类型分类参考；具体分类项、变体和正文解释未核验，也未保存穷举列表。"
  ],
  "extractable_fields": [
    "规范 URL",
    "页面标题",
    "屋顶分类定位"
  ],
  "knowledge_value": {
    "principles": {
      "value": 3,
      "reason": "类型分类可能体现构件选择原则，正文解释尚未核验。"
    },
    "construction_sequence": {
      "value": 2,
      "reason": "分类参考可辅助选型，但索引不支持完整施工顺序判断。"
    },
    "reference_case": {
      "value": 4,
      "reason": "屋顶分类对构件形态参考价值高，但不是单体建筑案例。"
    },
    "materials": {
      "value": 2,
      "reason": "索引确认类型主题，具体材料选择未核验。"
    },
    "survival_constraints": {
      "value": 1,
      "reason": "现有索引没有提供生存资源或施工限制证据。"
    },
    "evaluation": {
      "value": 4,
      "reason": "类型分类可支持屋顶形态比较，具体标准仍需复核。"
    },
    "provenance": {
      "value": 2,
      "reason": "集体编辑页面身份可识别，修订与贡献谱系未取得。"
    },
    "access_stability": {
      "value": 1,
      "reason": "自动直接访问返回 403，当前仅有陈旧索引依据。"
    },
    "rights_clarity": {
      "value": "unknown",
      "reason": "本轮没有直接核验页面各类内容的具体许可证据。"
    }
  },
  "rights_observations": {
    "public_access": {
      "status": "unknown",
      "evidence_url": null,
      "checked_at": "2026-08-25T00:00:00.000Z",
      "note": "HTTP 403 只描述本轮自动访问结果，不能证明人类浏览器不可访问或公开访问获准。"
    },
    "local_analysis": {
      "status": "not-reviewed",
      "evidence_url": null,
      "checked_at": "2026-08-25T00:00:00.000Z",
      "note": "除短原创观察外，本地分析权利与许可证条件尚未审查。"
    },
    "automated_retrieval": {
      "status": "not-reviewed",
      "evidence_url": null,
      "checked_at": "2026-08-25T00:00:00.000Z",
      "note": "robots、MediaWiki API 条款、速率和返回结构尚未审查，不尝试绕过限制。"
    },
    "artifact_download": {
      "status": "unknown",
      "evidence_url": null,
      "checked_at": "2026-08-25T00:00:00.000Z",
      "note": "未取得支持下载文章、图片、模板或其他制品的证据。"
    },
    "model_training": {
      "status": "unknown",
      "evidence_url": null,
      "checked_at": "2026-08-25T00:00:00.000Z",
      "note": "未取得支持模型训练的具体许可证据。"
    },
    "external_redistribution": {
      "status": "unknown",
      "evidence_url": null,
      "checked_at": "2026-08-25T00:00:00.000Z",
      "note": "未核验文本、图片、模板或结构化事实的外部再分发条件。"
    }
  },
  "blocking_conditions": [
    "具体类型、修订、贡献谱系和内容指纹未核验。",
    "自动访问、API 与具体权利边界尚未审查。"
  ],
  "recommended_adapter_behavior": [
    "获批后仅在 robots、API 与条款审查后使用修订绑定、保留署名的 MediaWiki 只读文章适配器。",
    "文本、图片和结构化事实必须作为不同权利类别处理，不直接进入课程、规则或训练。"
  ],
  "summary": "该探针只确认屋顶类型页的分类参考定位，不保存或重建缓存中的具体类型与变体列表。"
}
