{
  "schema_version": 1,
  "probe_id": "mcblock-modern-office-four-06941222",
  "source_id": "mcblock",
  "canonical_url": "https://mcblock.top/buildings/06941222-9fae-4045-882a-f82b4feb71f7",
  "title": "现代办公楼·四",
  "sample_role": "master-scale-modern-case",
  "selection_reason": "用于观察未知作者的大师级现代超大体量案例及动态详情的访问局限。",
  "observed_at": "2026-08-25T00:00:00.000Z",
  "observation_bases": [
    "direct-page",
    "site-claim",
    "project-inference"
  ],
  "access_result": {
    "status": "partial-js-render",
    "http_status": 200,
    "final_url": "https://mcblock.top/buildings/06941222-9fae-4045-882a-f82b4feb71f7",
    "note": "列表卡片短元数据可见，详情字段未稳定直读。"
  },
  "content_revision": {
    "status": "unknown",
    "value": null,
    "basis": "unverified"
  },
  "content_fingerprint": {
    "status": "unknown",
    "sha256": null,
    "basis": "unverified"
  },
  "creator_observation": {
    "status": "unknown",
    "display_name": null,
    "profile_url": null,
    "bases": [
      "project-inference"
    ]
  },
  "observed_structure": [
    "列表卡片观察：大师、约5.9万、113格高。",
    "列表卡片未提供足以确认作者的显式字段，作者保持未知。",
    "站点能力声明：提供三维预览、逐层学习、数量与导出格式入口；这些不是本案例的已核验详情事实。"
  ],
  "extractable_fields": [
    "列表标题",
    "列表难度",
    "列表近似方块量",
    "列表高度"
  ],
  "knowledge_value": {
    "principles": {
      "value": "unknown",
      "reason": "列表卡片不足以判断该现代办公楼采用的设计原则。"
    },
    "construction_sequence": {
      "value": 3,
      "reason": "站点声明支持逐层学习，但本探针未稳定直读该案例的逐层内容。"
    },
    "reference_case": {
      "value": 4,
      "reason": "大师难度、约5.9万和113格高度使其具有超大现代案例参考性。"
    },
    "materials": {
      "value": 2,
      "reason": "仅观察到约5.9万的列表量级，未读取材料清单。"
    },
    "survival_constraints": {
      "value": "unknown",
      "reason": "列表卡片没有提供生存模式成本或施工约束。"
    },
    "evaluation": {
      "value": 2,
      "reason": "难度、方块量和高度可供粗略比较，但没有系统评价。"
    },
    "provenance": {
      "value": 1,
      "reason": "案例 URL 和标题可识别，但作者没有直接证据。"
    },
    "access_stability": {
      "value": 1,
      "reason": "列表卡片可见而详情字段未稳定直读，访问稳定性较低。"
    },
    "rights_clarity": {
      "value": "unknown",
      "reason": "免费或导出入口不能证明下载、训练或再发布权利。"
    }
  },
  "rights_observations": {
    "public_access": {
      "status": "observed-allowed",
      "evidence_url": "https://mcblock.top/buildings/06941222-9fae-4045-882a-f82b4feb71f7",
      "checked_at": "2026-08-25T00:00:00.000Z",
      "note": "本次观察可读取公开页面和列表短元数据；不代表其他使用获许可。"
    },
    "local_analysis": {
      "status": "not-reviewed",
      "evidence_url": null,
      "checked_at": "2026-08-25T00:00:00.000Z",
      "note": "除本报告短事实与原创摘要外的本地分析权利未审查。"
    },
    "automated_retrieval": {
      "status": "not-reviewed",
      "evidence_url": null,
      "checked_at": "2026-08-25T00:00:00.000Z",
      "note": "自动检索条款、robots 与速率限制未审查。"
    },
    "artifact_download": {
      "status": "unknown",
      "evidence_url": null,
      "checked_at": "2026-08-25T00:00:00.000Z",
      "note": "未核验下载条件，导出声明不构成下载许可。"
    },
    "model_training": {
      "status": "unknown",
      "evidence_url": null,
      "checked_at": "2026-08-25T00:00:00.000Z",
      "note": "未发现可支持模型训练的明确许可。"
    },
    "external_redistribution": {
      "status": "unknown",
      "evidence_url": null,
      "checked_at": "2026-08-25T00:00:00.000Z",
      "note": "未发现允许再发布页面内容或制品的明确许可。"
    }
  },
  "blocking_conditions": [
    "作者未知且详情字段未稳定直读。",
    "自动访问、下载、训练与再发布权利尚未审查。"
  ],
  "recommended_adapter_behavior": [
    "获批后仅用站点专用只读适配器读取最小元数据或逐层查看入口。",
    "分别审查速率、登录、权利和导出边界，不直接进入课程、规则或训练。"
  ],
  "summary": "现代办公楼·四探针只保留列表卡片中的大师难度、近似方块量和高度，作者及详情字段保持未知。"
}
